{
  "$schema": "../annotation_schema.json",
  "document_id": "tier_b_hard_neg_06",
  "tier": "Tier B",
  "category": "hard_negative",
  "file_name": "tier_b_hard_neg_06_civil_engineering_soil_test.pdf",
  "sha256": "18a6d606e358003f5281a923e3f731bff3d9b4c0d50ad3aee5043421c332a3cc",
  "total_pages": 1,
  "provenance": {
    "source_family": "GEOTECHNICAL_ENGINEERING_BOREHOLE_LOG",
    "source_url": null,
    "access_date": null,
    "license_or_reuse_conditions": "Synthetic negative control fixture.",
    "generation_procedure": "Soil mechanics laboratory compressive strength and borehole strata report.",
    "is_synthetic": true,
    "limitations": "Strict negative control: 0 PII entities."
  },
  "expected_entities": [],
  "adjudication": {
    "annotator": "INDEPENDENT_EVAL_HARNESS",
    "reviewer": "STAGE_5_INDEPENDENT_AUDITOR",
    "status": "clean_negative",
    "notes": "Ground-truth verified for 0 entities. Checked coordinates and character offsets."
  }
}