{
  "$schema": "../annotation_schema.json",
  "document_id": "tier_a_digital_02",
  "tier": "Tier A",
  "category": "native_digital_pdf",
  "file_name": "tier_a_digital_02_university_transcript.pdf",
  "sha256": "159f2b2a070d9a7e0dbae6eab4df478605b0dc52f05b3610b098100ec7234e05",
  "total_pages": 1,
  "provenance": {
    "source_family": "ACADEMIC_STUDENT_TRANSCRIPT",
    "source_url": null,
    "access_date": null,
    "license_or_reuse_conditions": "Synthetic generated under MIT evaluation terms.",
    "generation_procedure": "Programmatic generation of semester grade card with student identifiers.",
    "is_synthetic": true,
    "limitations": "Tabular grade section with student identity header."
  },
  "expected_entities": [
    {
      "id": "ent_001",
      "entity_type": "DATE_OF_BIRTH",
      "text": "22/11/2004",
      "page_num": 1,
      "bbox": {
        "x0": 111.14,
        "y0": 119.25,
        "x1": 161.18,
        "y1": 132.99
      },
      "character_span": {
        "start": 125,
        "end": 135
      },
      "is_ocr_derived": false,
      "annotation_confidence": 1.0,
      "ambiguity_notes": "Unambiguous ground truth verified"
    },
    {
      "id": "ent_002",
      "entity_type": "EMAIL_ADDRESS",
      "text": "ananya.deshmukh@nit-eval.edu",
      "page_num": 1,
      "bbox": {
        "x0": 131.69,
        "y0": 139.25,
        "x1": 275.24,
        "y1": 152.99
      },
      "character_span": {
        "start": 154,
        "end": 182
      },
      "is_ocr_derived": false,
      "annotation_confidence": 1.0,
      "ambiguity_notes": "Unambiguous ground truth verified"
    },
    {
      "id": "ent_003",
      "entity_type": "PHONE_NUMBER",
      "text": "9123456789",
      "page_num": 1,
      "bbox": {
        "x0": 122.26,
        "y0": 159.25,
        "x1": 177.86,
        "y1": 172.99
      },
      "character_span": {
        "start": 199,
        "end": 209
      },
      "is_ocr_derived": false,
      "annotation_confidence": 1.0,
      "ambiguity_notes": "Unambiguous ground truth verified"
    },
    {
      "id": "ent_004",
      "entity_type": "PAN_NUMBER",
      "text": "CQRPD4019E",
      "page_num": 1,
      "bbox": {
        "x0": 152.26,
        "y0": 179.25,
        "x1": 217.28,
        "y1": 192.99
      },
      "character_span": {
        "start": 231,
        "end": 241
      },
      "is_ocr_derived": false,
      "annotation_confidence": 1.0,
      "ambiguity_notes": "Unambiguous ground truth verified"
    }
  ],
  "adjudication": {
    "annotator": "INDEPENDENT_EVAL_HARNESS",
    "reviewer": "STAGE_5_INDEPENDENT_AUDITOR",
    "status": "verified",
    "notes": "Ground-truth verified for 4 entities. Checked coordinates and character offsets."
  }
}