{
  "$schema": "../annotation_schema.json",
  "document_id": "tier_b_mock_kyc_05",
  "tier": "Tier B",
  "category": "independent_mock_kyc",
  "file_name": "tier_b_mock_kyc_05_housing_loan_co_applicant_kyc.pdf",
  "sha256": "6e282da9aa1d6bbda0baced25c55557843228fc1b1dee820bf6d92cbc2a5776a",
  "total_pages": 1,
  "provenance": {
    "source_family": "MORTGAGE_CO_APPLICANT_UNDERWRITING_DOSSIER",
    "source_url": null,
    "access_date": null,
    "license_or_reuse_conditions": "Independently authored synthetic record.",
    "generation_procedure": "Housing finance co-borrower credit assessment memorandum.",
    "is_synthetic": true,
    "limitations": "Detailed co-borrower personal and financial profile."
  },
  "expected_entities": [
    {
      "id": "ent_001",
      "entity_type": "AADHAAR_NUMBER",
      "text": "3311 2299 4488",
      "page_num": 1,
      "bbox": {
        "x0": 113.36,
        "y0": 119.25,
        "x1": 185.64,
        "y1": 132.99
      },
      "character_span": {
        "start": 127,
        "end": 141
      },
      "is_ocr_derived": false,
      "annotation_confidence": 1.0,
      "ambiguity_notes": "Unambiguous ground truth verified"
    },
    {
      "id": "ent_002",
      "entity_type": "PAN_NUMBER",
      "text": "RPTPS8812L",
      "page_num": 1,
      "bbox": {
        "x0": 100.57,
        "y0": 139.25,
        "x1": 161.71,
        "y1": 152.99
      },
      "character_span": {
        "start": 152,
        "end": 162
      },
      "is_ocr_derived": false,
      "annotation_confidence": 1.0,
      "ambiguity_notes": "Unambiguous ground truth verified"
    },
    {
      "id": "ent_003",
      "entity_type": "DATE_OF_BIRTH",
      "text": "07/09/1985",
      "page_num": 1,
      "bbox": {
        "x0": 111.14,
        "y0": 159.25,
        "x1": 161.18,
        "y1": 172.99
      },
      "character_span": {
        "start": 178,
        "end": 188
      },
      "is_ocr_derived": false,
      "annotation_confidence": 1.0,
      "ambiguity_notes": "Unambiguous ground truth verified"
    },
    {
      "id": "ent_004",
      "entity_type": "PHONE_NUMBER",
      "text": "9820011223",
      "page_num": 1,
      "bbox": {
        "x0": 85.01,
        "y0": 179.25,
        "x1": 140.61,
        "y1": 192.99
      },
      "character_span": {
        "start": 197,
        "end": 207
      },
      "is_ocr_derived": false,
      "annotation_confidence": 1.0,
      "ambiguity_notes": "Unambiguous ground truth verified"
    },
    {
      "id": "ent_005",
      "entity_type": "BANK_ACCOUNT",
      "text": "50100293847120",
      "page_num": 1,
      "bbox": {
        "x0": 122.81,
        "y0": 199.25,
        "x1": 200.65,
        "y1": 212.99
      },
      "character_span": {
        "start": 224,
        "end": 238
      },
      "is_ocr_derived": false,
      "annotation_confidence": 1.0,
      "ambiguity_notes": "Unambiguous ground truth verified"
    },
    {
      "id": "ent_006",
      "entity_type": "IFSC_CODE",
      "text": "HDFC0000180",
      "page_num": 1,
      "bbox": {
        "x0": 112.8,
        "y0": 219.25,
        "x1": 179.49,
        "y1": 232.99
      },
      "character_span": {
        "start": 252,
        "end": 263
      },
      "is_ocr_derived": false,
      "annotation_confidence": 1.0,
      "ambiguity_notes": "Unambiguous ground truth verified"
    }
  ],
  "adjudication": {
    "annotator": "INDEPENDENT_EVAL_HARNESS",
    "reviewer": "STAGE_5_INDEPENDENT_AUDITOR",
    "status": "verified",
    "notes": "Ground-truth verified for 6 entities. Checked coordinates and character offsets."
  }
}