{
  "$schema": "../annotation_schema.json",
  "document_id": "tier_b_mock_kyc_03",
  "tier": "Tier B",
  "category": "independent_mock_kyc",
  "file_name": "tier_b_mock_kyc_03_telecom_sim_caf_customer_profile.pdf",
  "sha256": "303d7897aa9ac0aa33c8a4d87abe128162716f0db306a1e10c5cb7bdbfce0d0d",
  "total_pages": 1,
  "provenance": {
    "source_family": "TELECOM_CUSTOMER_ACQUISITION_FORM",
    "source_url": null,
    "access_date": null,
    "license_or_reuse_conditions": "Independently authored synthetic record.",
    "generation_procedure": "Department of Telecom digital Customer Acquisition Form.",
    "is_synthetic": true,
    "limitations": "Digital CAF format."
  },
  "expected_entities": [
    {
      "id": "ent_001",
      "entity_type": "AADHAAR_NUMBER",
      "text": "8822 3311 4400",
      "page_num": 1,
      "bbox": {
        "x0": 137.81,
        "y0": 119.25,
        "x1": 210.09,
        "y1": 132.99
      },
      "character_span": {
        "start": 140,
        "end": 154
      },
      "is_ocr_derived": false,
      "annotation_confidence": 1.0,
      "ambiguity_notes": "Unambiguous ground truth verified"
    },
    {
      "id": "ent_002",
      "entity_type": "PHONE_NUMBER",
      "text": "+91 98790 12345",
      "page_num": 1,
      "bbox": {
        "x0": 165.05,
        "y0": 139.25,
        "x1": 243.17,
        "y1": 152.99
      },
      "character_span": {
        "start": 181,
        "end": 196
      },
      "is_ocr_derived": false,
      "annotation_confidence": 1.0,
      "ambiguity_notes": "Unambiguous ground truth verified"
    },
    {
      "id": "ent_003",
      "entity_type": "EMAIL_ADDRESS",
      "text": "mallika.s@telecom-caf.demo",
      "page_num": 1,
      "bbox": {
        "x0": 131.13,
        "y0": 159.25,
        "x1": 259.64,
        "y1": 172.99
      },
      "character_span": {
        "start": 215,
        "end": 241
      },
      "is_ocr_derived": false,
      "annotation_confidence": 1.0,
      "ambiguity_notes": "Unambiguous ground truth verified"
    },
    {
      "id": "ent_004",
      "entity_type": "DATE_OF_BIRTH",
      "text": "09/05/1954",
      "page_num": 1,
      "bbox": {
        "x0": 111.14,
        "y0": 179.25,
        "x1": 161.18,
        "y1": 192.99
      },
      "character_span": {
        "start": 257,
        "end": 267
      },
      "is_ocr_derived": false,
      "annotation_confidence": 1.0,
      "ambiguity_notes": "Unambiguous ground truth verified"
    },
    {
      "id": "ent_005",
      "entity_type": "VOTER_ID",
      "text": "GJH1928401",
      "page_num": 1,
      "bbox": {
        "x0": 212.29,
        "y0": 199.25,
        "x1": 271.21,
        "y1": 212.99
      },
      "character_span": {
        "start": 305,
        "end": 315
      },
      "is_ocr_derived": false,
      "annotation_confidence": 1.0,
      "ambiguity_notes": "Unambiguous ground truth verified"
    }
  ],
  "adjudication": {
    "annotator": "INDEPENDENT_EVAL_HARNESS",
    "reviewer": "STAGE_5_INDEPENDENT_AUDITOR",
    "status": "verified",
    "notes": "Ground-truth verified for 5 entities. Checked coordinates and character offsets."
  }
}